{
  "record_version": "1.0",
  "source": {
    "source_id": "JPL_HORIZONS",
    "endpoint_id": "horizons_api",
    "endpoint_url": "https://ssd.jpl.nasa.gov/api/horizons.api"
  },
  "acquisition": {
    "retrieved_utc": "2025-12-21T00:50:50Z",
    "query_parameters": {
      "format": "json",
      "COMMAND": "'3I/ATLAS'",
      "OBJ_DATA": "YES",
      "MAKE_EPHEM": "YES",
      "EPHEM_TYPE": "OBSERVER",
      "CENTER": "500@399",
      "START_TIME": "2025-01-01",
      "STOP_TIME": "2025-01-02",
      "STEP_SIZE": "1d",
      "QUANTITIES": "1,9,20,23,24"
    },
    "http_status": 200,
    "response_headers": {
      "content-type": "application/json",
      "date": "2025-12-21T00:50:50Z"
    }
  },
  "integrity": {
    "sha256": "5c05d9438d9d88e571e492ba9efa1cfa2843dcb298b248592c7e25f34b4f5277",
    "size_bytes": 4930
  },
  "raw_data_ref": {
    "relative_path": "data/raw/JPL_HORIZONS/2025-12-21/horizons_3I_ATLAS.json",
    "format": "json"
  },
  "metadata": {
    "target": "3I/ATLAS",
    "notes": "Canonical fetch for 3I/ATLAS from JPL Horizons API"
  }
}
